{
  "action_taken": "AUTO_DETECTED",
  "agent_id": "bf0180b5-d1f8-4336-835d-5321684d5b34",
  "detected_at": "2026-02-01T12:09:04.855700+00:00",
  "evidence": {
    "detector_rule_id": "GOV_COERCIVE_BINDING",
    "detector_version": "1.0.0",
    "excerpt_hash": "5d97e0ba7a27dba566cd2ec52bf4a47687c921ad5fe8c73aa1d111c7ad2d23d8",
    "excerpt_length": 71,
    "pattern_matches": [
      {
        "matches": [
          "mandatory",
          "required",
          "shall"
        ],
        "type": "keyword_match"
      },
      {
        "matches": [
          "mandatory participation",
          "you shall"
        ],
        "type": "phrase_match"
      }
    ],
    "platform": "test_fixture",
    "source_id": "msg_102",
    "total_matches": 5
  },
  "reason_code": "BH_COERCIVE_BINDING_PROTOCOL",
  "severity": "critical"
}